{
  "id": "10000000-0000-4000-8000-000000000001",
  "workspace_id": "10000000-0000-4000-8000-000000000002",
  "aggregate_version": 1,
  "created_at": "2026-08-13T10:00:00Z",
  "created_by": { "actor_type": "HUMAN", "actor_id": "developer-1" },
  "updated_at": "2026-08-13T10:00:00Z",
  "updated_by": { "actor_type": "HUMAN", "actor_id": "developer-1" }
}
